Hurricane Michael October 2018,10/10/2018,10/11/2018,49,$25.00 ,"Powerful category 5 hurricane made landfall at Mexico Beach, Florida with devastating winds of 160 mph and storm surge in excess of 15 feet. Mexico Beach was nearly destroyed, while Panama City suffered extensive damage. Florida's Tyndall Air Force Base also suffered a direct strike from Michael's most intense eye wall winds causing billions in damage costs. Michael's intense winds also reached well inland causing billions in damage costs to agriculture and forestry, as high winds hit during harvest season for numerous crops across several states. Michael is the third category 4 or higher storm to make landfall in the U.S. since 2017. Michael is the first category 5 to strike the U.S. mainland since Hurricane Andrew in 1992 and is only the fourth on record. The others are the Labor Day Hurricane (1935) and Hurricane Camille (1969). Michael was initially rated as a category 4 with 155 winds but upgraded to a category 5 with 160 mph winds upon further analysis."
Hurricane Florence September 2018,9/13/2018,9/16/2018,53,$24.00 ,"Hurricane Florence was a large and very slow moving hurricane that produced extreme rainfall across eastern North Carolina (up to 35.93"") and South Carolina (up to 23.81""), as prodigious amounts of rainfall were common in many locations. Florence made landfall as a category 1, at Wrightsville Beach, NC with damaging storm surge up to 10 feet and wind gusts reported over 100 mph. However, the majority of the damage caused by Florence was due to the rainfall inland, which caused many rivers to surpass previous record flood heights. U.S. Marine base Camp Lejeune in North Carolina suffered extensive damage that will cost billions to repair. The total damage from Florence in North Carolina is more than the cost experienced during Hurricane Matthew (2016) and Hurricane Floyd (1999) combined."
Rockies and Plains Hail Storms August 2018,8/6/2018,8/7/2018,0,$1.00 ,"Severe hail impacts from baseball to softball size impacted several states including Colorado, Nebraska and Wyoming. The most costly impacts occurred in numerous locations of eastern Colorado."
Central and Eastern Tornadoes and Severe Weather July 2018,7/19/2018,7/22/2018,0,$1.60 ,"At least 41 tornadoes and high wind damage from thunderstorms impact numerous Central and Eastern states (MO, IA, IL, IN, KS, KY, AL, AR, GA, TN, NC, SC, VA, MD, PA) over a multi-day event. The tornado damage was most severe across Iowa."
Colorado Hail Storm June 2018,6/18/2018,6/19/2018,0,$2.20 ,"Severe hail storms cause golf ball to baseball-sized hail and widespread damage in many areas from northern Denver to Boulder and Fort Collins. Many homes, businesses and vehicles were impacted. Utah also experienced moderate hail damage."
Texas Hail Storm June 2018,6/6/2018,6/6/2018,0,$1.30 ,"Large-hail impacts highly-populated area of the Dallas-Ft. Worth metroplex. Golfball to baseball-sized hail damages many homes, vehicles and businesses."
Central and Eastern Severe Weather May 2018,5/13/2018,5/15/2018,5,$1.40 ,"Severe storm damage across many Central states including TX, KS, CO, OK, MO, IL, IN, IA and OH. This was followed by a derecho event across the Northeastern states of MD, NJ, NY, PA, VA, WV, MA and CT that caused widespread high wind damage. Also, there were one dozen tornadoes reported across PA, NY and CT causing further damage."
Central and Northeastern Severe Weather May 2018,5/1/2018,5/4/2018,0,$1.40 ,"Numerous central states (KS, NE, OK, TX, NM, MO, IA, IL, IN, OH, WI) were impacted by large hail and tornadoes. Several northeastern states including NY, PA and VT were also impacted by high wind damage from severe storms."
Southern and Eastern Tornadoes and Severe Weather April 2018,4/13/2018,4/16/2018,3,$1.30 ,"Tornadoes and severe storms with large hail cause widespread damage across many Southern and Eastern states (AR, FL, GA, LA, MD, MI, MS, MO, NJ, NY, NC, PA, SC, TX, VA) over a multi-day period. There were over 70 confirmed tornadoes largely clustered in Louisiana, Mississippi, North Carolina and Virginia. This same system also caused winter storm impacts of high wind and ice accumulation in northeastern states."
Southeastern Tornadoes and Severe Weather March 2018,3/18/2018,3/21/2018,0,$1.50 ,"A potent severe storm system caused over 20 tornadoes across Alabama and also widespread hail damage from Texas to Florida. Most notably this system produced an EF-3 tornado that caused extensive damage in Jacksonville, Alabama and across the campus of Jacksonville State University."
Northeast Winter Storm March 2018,3/1/2018,3/3/2018,9,$2.20 ,"Powerful Nor'easter impacted many Northeastern states including MD, MA, NH, NJ, NY, PA, CT, DE, RA and VA. Widespread damage resulted from the combination of high winds, heavy snow and heavy coastal erosion."
Central and Eastern Winter Storm January 2018,1/3/2018,1/5/2018,22,$1.00 ,"A Nor'easter caused damage across many Northeastern states including MA, NJ, NY, CT, ME, NH, PA, MD, RI, SC, TN, VA, NC and GA."
"Western Wildfires, California Firestorm Summer-Fall 2017",6/1/2017,12/31/2017,54,$18.00 ,"A historic firestorm damages or destroys over 15,000 homes, businesses and other structures across California in October. The combined destruction of the Tubbs, Atlas, Nuns and Redwood Valley wildfires represent the most costly wildfire event on record, also causing 44 deaths. Extreme wildfire conditions in early December also burned hundreds of homes in Los Angeles. Numerous other wildfires across many western and northwestern states burn over 9.8 million acres exceeding the 10-year annual average of 6.5 million acres. Montana in particular was affected by wildfires that burned in excess of 1 million acres. These wildfire conditions were enhanced by the preceding drought conditions in several states."
"North Dakota, South Dakota and Montana Drought Spring-Fall 2017",3/1/2017,12/31/2017,0,$2.50 ,"Extreme drought causes extensive impacts to agriculture in North Dakota, South Dakota and Montana. Field crops including wheat were severely damaged and the lack of feed for cattle forced ranchers to sell off livestock. This drought has also contributed to the increased potential for severe wildfires."
Hurricane Maria September 2017,9/19/2017,9/21/2017,2981,$90.00 ,"Category 4 hurricane made landfall in southeast Puerto Rico after striking the U.S. Virgin Island of St. Croix. Maria's high winds caused widespread devastation to Puerto Rico's transportation, agriculture, communication and energy infrastructure. Extreme rainfall up to 37 inches caused widespread flooding and mudslides across the island. The interruption to commerce and standard living conditions will be sustained for a long period, as much of Puerto Rico's infrastructure is rebuilt. Maria tied Hurricane Wilma (2005) for the most rapid intensification, strengthening from tropical depression to a category 5 storm in 54 hours. Maria's landfall at Category 4 strength gives the U.S. a record three Category 4+ landfalls this year (Maria, Harvey, and Irma). Maria was one of the deadliest storms to impact the U.S., with numerous indirect deaths in the wake of the storm's devastation."
Hurricane Irma September 2017,9/6/2017,9/12/2017,97,$50.00 ,"Category 4 hurricane made landfall at Cudjoe Key, Florida after devastating the U.S. Virgin Islands - St John and St Thomas - as a category 5 storm. The Florida Keys were heavily impacted, as 25% of buildings were destroyed while 65% were significantly damaged. Severe wind and storm surge damage also occurred along the coasts of Florida and South Carolina. Jacksonville, FL and Charleston, SC received near-historic levels of storm surge causing significant coastal flooding. Irma maintained a maximum sustained wind of 185 mph for 37 hours, the longest in the satellite era. Irma also was a category 5 storm for longer than all other Atlantic hurricanes except Ivan in 2004."
Hurricane Harvey August 2017,8/25/2017,8/31/2017,89,$125.00 ,"Category 4 hurricane made landfall near Rockport, Texas causing widespread damage. Harvey's devastation was most pronounced due to the large region of extreme rainfall producing historic flooding across Houston and surrounding areas. More than 30 inches of rainfall fell on 6.9 million people, while 1.25 million experienced over 45 inches and 11,000 had over 50 inches, based on 7-day rainfall totals ending August 31. This historic U.S. rainfall caused massive flooding that displaced over 30,000 people and damaged or destroyed over 200,000 homes and businesses."
Midwest Severe Weather June 2017,6/27/2017,6/29/2017,0,$1.40 ,"Severe hail and high wind damage impacting Nebraska, Illinois and Iowa. More than one dozen tornadoes touched down across parts of Iowa, in addition to other storm damage."
Midwest Severe Weather June 2017,6/12/2017,6/16/2017,0,$1.50 ,"Severe hail, high winds and numerous tornadoes impact many states over several days including WY, TX, NE, KS, MO, IA, IL, PA, VA, NY."
Minnesota Hail Storm and Upper Midwest Severe Weather June 2017,6/9/2017,6/11/2017,0,$2.40 ,"Severe hail and high winds cause considerable damage across Minnesota and Wisconsin. The Minneapolis metro area in particular was damaged from large, destructive hail impacting many buildings and vehicles. This damage is comparable to the May 15, 1998 Minnesota hail storm that was also very costly."
Colorado Hail Storm and Central Severe Weather May 2017,5/8/2017,5/11/2017,0,$3.40 ,"Hail storm and wind damage impacting several states including CO, OK, TX, NM, MO. The most costly impacts were in the Denver metro region where baseball-sized hail caused the most expensive hail storm in Colorado history, with insured losses exceeding $2.2 ($2.4) billion."
Missouri and Arkansas Flooding and Central Severe Weather May 2017,4/25/2017,5/7/2017,20,$1.70 ,"A period of heavy rainfall up to 15 inches over a multi-state region in the Midwest caused historic levels of flooding along many rivers. The flooding was most severe in Missouri, Arkansas and southern Illinois where levees were breached and towns were flooded. There was widespread damage to homes, businesses, infrastructure and agriculture. Severe storms also caused additional impacts during the flooding event across a number of central and southern states."
South/ Southeast Severe Weather March 2017,3/26/2017,3/28/2017,0,$2.70 ,"Large hail and high winds in Texas north of the Dallas metro region caused widespread damage to structures and vehicles. Severe storms also caused damage across several other states (OK, TN, KY, MS, AL) due to the combination of high winds, hail and tornadoes."
Southeast Freeze March 2017,3/14/2017,3/16/2017,0,$1.00 ,"Severe freeze heavily damaged fruit crops across several southeastern states (SC, GA, NC, TN, AL, MS, FL, KY, VA). Mid-March freezes are not climatologically unusual in the Southeast, however many crops were blooming 3+ weeks early due to unusually warm temperatures during the preceding weeks. Damage was most severe in Georgia and South Carolina. Crops most impacted include peaches, blueberries, strawberries and apples, among others."
Midwest Tornado Outbreak March 2017,3/6/2017,3/8/2017,2,$2.20 ,"Tornado outbreak and wind damage across many Midwestern states (AR, IA, IL, KS, MI, MN, MO, NE, NY, OH, WI). Missouri and Illinois were impacted by numerous tornadoes while Michigan and New York were affected by destructive, straight-line winds following the storm system. Nearly one million customers lost power in Michigan alone due to sustained high winds, which affected several states from Illinois to New York."
Central/ Southeast Tornado Outbreak March 2017,2/28/2017,3/1/2017,6,$1.80 ,Over 70 tornadoes developed during a widespread outbreak across many central and southern states causing significant damage. There was also widespread straight-line wind and hail damage. This was the second largest tornado outbreak to occur early in 2017.
California Flooding February 2017,2/8/2017,2/22/2017,5,$1.50 ,"Heavy, persistent rainfall across northern and central California created substantial property and infrastructure damage from flooding, landslides and erosion. Notable impacts include severe damage to the Oroville Dam spillway, which caused a multi-day evacuation of 188,000 residents downstream. Excessive rainfall also caused flood damage in the city of San Jose, as Coyote Creek overflowed its banks and inundated neighborhoods forcing 14,000 residents to evacuate."
Southern Tornado Outbreak and Western Storms January 2017,1/20/2017,1/22/2017,24,$1.10 ,"High wind damage occurred across southern California near San Diego followed by 79 confirmed tornadoes during an outbreak across many southern states including AL, FL, GA, LA, MS, SC and TX. This was the 3rd most tornadoes to occur in a single outbreak of extreme weather during a winter month (Dec.-Feb.) based on records from 1950."
Western/ Southeast Wildfires Summer-Fall 2016,6/1/2016,12/31/2016,21,$2.40 ,"Western and Southern states experienced an active wildfire season with over 5.0 million acres burned nationally. Most notable was the firestorm that impacted Gatlinburg, Tennessee with hurricane-force wind gusts in extremely dry conditions creating volatile wildfire behavior. These wildfires destroyed nearly 2,500 structures and caused 14 fatalities. The drought conditions in many areas of the Southeast and California worsened the wildfire potential."
West/ Northeast/ Southeast Drought 2016,1/1/2016,12/31/2016,0,$3.40 ,"California's 5-year drought persisted during 2016 while new areas of extreme drought developed in states across the Northeast and Southeast. The long-term impacts of the drought in California have damaged forests where 100+ million trees have perished and are a public safety hazard. The agricultural impacts were reduced in California as water prices and crop fallowing declined. However, agricultural impacts developed in Northeast and Southeast due to stressed water supplies."
Hurricane Matthew October 2016,10/8/2016,10/12/2016,49,$10.00 ,"Category 1 hurricane made landfall in North Carolina, after it paralleled the Southeast coast along Florida, Georgia and the Carolinas causing widespread damage from wind, storm surge and inland flooding. The most costly impacts were due to historic levels of river flooding in eastern North Carolina where 100,000 homes, businesses and other structures were damaged. This inland flooding was comparable to Hurricane Floyd (1999) that also impacted eastern North Carolina. Matthew narrowly missed landall on Florida's east coast as a powerful category 4 storm."
Louisiana FloodingAugust 2016,8/12/2016,8/15/2016,13,$10.00 ,"A historic flood devastated a large area of southern Louisiana resulting from 20 to 30 inches of rainfall over several days. Watson, Louisiana received an astounding 31.39 inches of rain from the storm. Two-day rainfall totals in the hardest hit areas have a 0.2% chance of occurring in any given year: a 1 in 500 year event. More than 30,000 people were rescued from the floodwaters that damaged or destroyed over 50,000 homes, 100,000 vehicles and 20,000 businesses. This is the most damaging U.S. flood event since Superstorm Sandy impacted the Northeast in 2012."
Rockies and Northeast Severe Weather July 2016,7/28/2016,7/30/2016,0,$1.50 ,"Severe storms across the Rockies and Northeastern states (CO, WY, VA, MD, PA, NJ, NY) caused large hail and high wind damage. Storm damage in Colorado was the most costly due to hail."
West Virginia Flooding and Ohio Valley TornadoesJune 2016,6/22/2016,6/24/2016,23,$1.00 ,"Torrential rainfall caused destructive flooding through many West Virginia towns, damaging thousands of homes and businesses and causing considerable loss of life. Over 1,500 roads and bridges were damaged or destroyed making the impact on infrastructure comparable to the historic 2013 Colorado flood. The storm system also produced numerous tornadoes causing damage across several Ohio Valley states."
Rockies/ Central Tornadoes and Severe Weather May 2016,5/21/2016,5/26/2016,0,$1.10 ,"Sustained period of severe thunderstorms and tornadoes affecting several states including Montana, Colorado, Kansas, Missouri and Texas. The most concentrated days for tornado development were on May 22 and 24. Additional damage was created by straight-line high wind and hail damage."
Plains Tornadoes and Central Severe Weather May 2016,5/8/2016,5/11/2016,2,$1.70 ,"Tornadoes and severe storms cause widespread damage across the Plains and Central states (NE, MO, TX, OK, KS, CO, IL, KY, TN) over a multi-day period. The damage from tornadoes and high wind was most costly in Nebraska and Missouri."
South/ Southeast Tornadoes April 2016,4/26/2016,5/2/2016,6,$2.40 ,Large outbreak of tornadoes affects numerous states across the South and Southeast. Additional damage also from large hail and straight-line wind during the multi-day thunderstorm event.
Houston Flooding April 2016,4/17/2016,4/18/2016,8,$2.70 ,"A period of extreme rainfall up to 17 inches created widespread urban flooding in Houston and surrounding suburbs. Thousands of homes and businesses were damaged and more than 1,800 high water rescues were conducted. This represents the most widespread flooding event to affect Houston since Tropical Storm Allison in 2001."
North/ Central Texas Hail Storm April 2016,4/10/2016,4/12/2016,0,$3.50 ,"Widespread severe hail damage across north and central Texas including the cities of Plano, Wylie, Frisco, Allen and San Antonio. The damage in San Antonio was particularly severe as the National Weather Service verified reports of hail size reaching 4.5 inches in diameter. This ranks as one of the most costly hail events to affect the United States."
North Texas Hail Storm March 2016,3/23/2016,3/24/2016,0,$2.10 ,"Large hail and strong winds caused considerable damage in heavily populated areas of north Texas. This damage was most notable in the cities of Dallas, Fort Worth and Plano."
Southern Severe Weather March 2016,3/17/2016,3/18/2016,1,$1.20 ,"Severe hail impacts the Fort Worth and Arlington metro region in Texas. Additional large hail and high wind damage occurred in other locations of Texas, Louisiana and Mississippi."
Texas and Louisiana Flooding March 2016,3/8/2016,3/12/2016,5,$2.30 ,"Multiple days of heavy rainfall averaging 15 to 20 inches led to widespread flooding along the Sabine River basin on the Texas and Louisiana border. This prompted numerous evacuations, high-water rescues and destruction, as more than 1,000 homes and businesses were damaged or destroyed."
Southeast and Eastern Tornadoes February 2016,2/22/2016,2/24/2016,10,$1.00 ,"Early outbreak of tornadoes and severe weather across many southern and eastern states including (AL, CT, FL, GA, LA, MA, MD, MS, NC, NJ, NY, PA, SC, TX, VA). There were at least 50 confirmed tornadoes causing widespread damage."
Western Drought 2015,1/1/2015,12/31/2015,0,$4.50 ,"Drought conditions were present across numerous western states (CA, NV, OR, WA, ID, MT, UT, AZ) with the most severe conditions continuing to plague California for all of 2015. The agriculture sector was again impacted by a lack of rainfall resulting in hundreds of thousands of acres of farmland remaining fallow and requiring excess groundwater pumping to irrigate existing agriculture interests. Wildfire conditions were further enhanced by the ongoing drought. California experienced extensive damage from both drought and wildfire impacts. Drought conditions did improve dramatically across Texas and Oklahoma, in the form of several major flood events."
Texas Tornadoes and Midwest Flooding December 2015,12/26/2015,12/29/2015,50,$2.00 ,"A powerful storm system packing unseasonably strong tornadoes caused widespread destruction in the Dallas metropolitan region, damaging well over 1,000 homes and businesses. This same potent system also produced intense rainfall over several Midwestern states triggering historic flooding that has approached or broken records at river gauges in several states (MO, IL, AR, TN, MS, LA). The flooding has overtopped levees and caused damage in numerous areas. This historic storm also produced high wind, snow and ice impacts from New Mexico through the Midwest and into New England. Overall, the storm caused at least 50 deaths from the combined impact of tornadoes, flooding and winter weather."
Western and Alaskan Wildfires Summer-Fall 2015,6/1/2015,11/30/2015,12,$3.00 ,"Wildfires burned over 10.1 million acres across the U.S. in 2015, surpassing 2006 for the highest annual total of U.S. acreage burned since record-keeping began in 1960. The most costly wildfires occurred in California where over 2,500 structures were destroyed due to the Valley and Butte wildfires with the insured losses alone exceeding $1.0 ($1.2) billion. The most extensive wildfires occurred in Alaska where over 5 million acres burned within the state. There was extensive burnt acreage across other western states, most notably (OR, WA, ID, MT, ND, CO, WY, TX)."
South Carolina and East Coast Flooding October 2015,10/1/2015,10/5/2015,25,$2.00 ,"Historic levels of flooding impacted South Carolina causing widespread damage to many homes, businesses, public buildings and infrastructure. This interrupted commerce and closed major transportation corridors (such as I-95) for weeks as rivers slowly receded. Locally extreme rainfall totals exceeding 20-inches were common resulting from the convergence of a powerful low pressure system / frontal boundary and copious moisture from Hurricane Joaquin in the Atlantic."
Central and Northeast Severe Weather June 2015,6/21/2015,6/25/2015,1,$1.20 ,"Severe storms across numerous Central and Northeast states (CO, CT, IA, IL, MD, MI, NJ, NY, PA, SD, VA, WI) with widespread hail and high wind damage."
Texas and Oklahoma Flooding and Severe Weather May 2015,5/23/2015,5/26/2015,31,$2.50 ,"A slow-moving system caused tremendous rainfall and subsequent flooding to occur in Texas and Oklahoma. The Blanco river in Texas swelled from 5 feet to a crest of more than 40 feet over several hours causing considerable property damage and loss of life. The city of Houston also experienced flooding which resulted in hundreds of high-water rescues. The damage in Texas alone exceeded $1.0 ($1.2) billion. There was also damage in other states (KS, CO, AR, OH, LA, GA, SC) from associated severe storms."
Southern Plains Tornadoes May 2015,5/6/2015,5/10/2015,4,$1.30 ,"Tornado outbreak across the Southern Plain states (IA, KS, NE, OK, CO, SD, TX) with 122 tornadoes. The most costly damage occurred across Texas and Oklahoma."
South/ Southeast Severe Weather April 2015,4/18/2015,4/20/2015,0,$1.1*,"Severe storms across the South and Southeastern states (AL, AR, FL, GA, KS, LA, MS, NC, OK, SC, TN, TX). High winds and severe hail created the most significant damage in Texas."
Midwest/ Ohio Valley Severe Weather April 2015,4/7/2015,4/9/2015,2,$1.50 ,"Severe storms across the Midwest and Ohio Valley including the states (AR, IA, IL, IN, KS, KY, MI, MO, NC, OH, OK, PA, TN, TX, WI, WV). Large hail and high winds created the most damage across Missouri and Illinois."
"Central and Eastern Winter storm, Cold Wave February 2015",2/14/2015,2/20/2015,30,$1.80 ,"A large winter storm and associated cold wave impacted many central, eastern and northeastern states (CT, DE, GA, IL, KY, MA, MD, ME, MI, NC, NH, NJ, NY, OH, PA, RI, SC, TN, VA). The city of Boston was particularly impacted as feet of snow continued to accumulate causing load-stress on buildings and clogging transportation corridors. Total, direct losses in Massachusetts alone exceed $1.0 ($1.2) billion for this event, with considerable damage in many other states."
Western Drought 2014,1/1/2014,12/31/2014,0,$3.40 ,"Historic drought conditions affected the majority of California for all of 2014 making it the worst drought on record for the state. Surrounding states and parts of Texas, Oklahoma and Kansas also experienced continued severe drought conditions. This is a continuation of drought conditions that have persisted for several years."
Rockies/ Plains Severe Weather September 2014,9/29/2014,10/2/2014,0,$4.50 ,"Severe storms across the Rockies and Plains states (CO, KS, TX). Large hail and high winds created significant damage across eastern Colorado and Texas, particularly in the Dallas metro area."
Michigan and Northeast Flooding August 2014,8/11/2014,8/13/2014,2,$1.60 ,"Heavy rainfall in excess of 5 inches caused significant flooding in cities across Michigan damaging thousands of cars, business, homes and other infrastructure. Flooding also occurred across Maryland and New York's Long Island, as the slow-moving storm system delivered 24-hour rainfall exceeding 6 and 12 inches, respectively, creating more flood damage. Islip, NY received 13.57 inches of rain over a 24-hour period on Aug 12-13 setting a new 24-hour precipitation record for New York."
Rockies/ Central Plains Severe Weather June 2014,6/3/2014,6/5/2014,2,$1.20 ,"Severe storms across the Rockies and Central Plains states (NE, KS, WY, IA, AR). Wind gusts exceeding 90 mph and baseball to softball sized hail caused severe damage to structures and vehicles in central and eastern Nebraska."
Rockies/ Midwest/ Eastern Severe Weather May 2014,5/18/2014,5/23/2014,0,$2.20 ,"Severe storms across the Rockies, Midwest and Eastern states (CO, MT, IA, IL, IN, OH, SC, VA, PA, DE, NY) with the most costly damage in Colorado, Illinois and Pennsylvania."
